source,author,title,description,url,urlToImage,publishedAt,content
Independent,"Jack de Menezes, Jack de Menezes",England vs South Africa: How did it all go so wrong on the big stage of a Rugby World Cup final?,Eddie Jones's side came crashing down to earth in the worst possible way as the Springboks destroyed their World Cup dream,https://www.independent.co.uk/sport/rugby/rugby-union/international/england-vs-south-africa-rugby-world-cup-final-2019-how-did-it-go-wrong-scrums-a9182571.html,https://static.independent.co.uk/s3fs-public/thumbnails/image/2019/11/02/17/south-africa-scrum.jpg,2019-11-03T08:06:14Z,"How did England go from such a dominant performance against the reigning and dethroned world champions, to coming so brutally unstuck against the new anointed kings of the globe?
Eddie Jones didnt have the answer following Englands humbling 32-12 defeat agai… [+6723 chars]"
Stuff.co.nz,MICK CLEARY,England v Springboks: Power battle to be defining factor in Rugby World Cup final,"England urged to ""throw all of themselves"" into one last, brutal clash to cement their place in history.",https://www.stuff.co.nz/sport/rugby/rugby-world-cup/rwc-2019-japan/117118519/england-v-springboks-power-battle-to-be-defining-factor-in-rugby-world-cup-final,https://resources.stuff.co.nz/content/dam/images/1/x/q/9/d/9/image.related.StuffLandscapeSixteenByNine.1420x800.1xq987.png/1572674544913.jpg,2019-11-02T06:02:24Z,"Owen Farrell urged his team-mates at his eve-of-match captain's meeting to ""throw all of themselves"" into the Rugby World Cup final against South Africa in Yokohama, knowing that nerve, boldness and togetherness are imperative if England are to deny the Sprin… [+5811 chars]"
Independent,"Tola Fisher, Tola Fisher",Alcohol consumption will soon follow smoking and meat-eating in becoming a social evil,The number of units people drink is declining and consuming less may soon become a badge of honour in the same way not smoking or not eating meat have become,https://www.independent.co.uk/voices/alcohol-drinking-smoking-meat-eating-society-a9183206.html,https://static.independent.co.uk/s3fs-public/thumbnails/image/2019/10/25/12/alcohol-3634581.jpg,2019-11-03T15:16:20Z,"I grew up in a teetotal household and my siblings still dont drink. I was with my ex-husband on my first visit to a pub and I asked the baffled bartender if they had any herbal teas. By the time we split up, I was pairing wine with my food and turning my nose… [+23316 chars]"
Stuff.co.nz,DUNCAN GARNER,NZ has changed for the better - now we need to talk about the future,"OPINION: We're no longer rugby obsessed, and that's good. But what will 2095 look like?",https://www.stuff.co.nz/sport/rugby/all-blacks/117101244/nz-has-changed-for-the-better--now-we-need-to-talk-about-the-future,https://resources.stuff.co.nz/content/dam/images/1/x/p/x/r/m/image.related.StuffLandscapeSixteenByNine.1420x800.1xpvwc.png/1572588993317.jpg,2019-11-02T04:10:00Z,"OPINION: I haven't mourned and moped around one bit since the English rugby team's almost perfect kamikaze assault on the woeful All Blacks last weekend.
 I have barely cared, except to ask if anyone is showing the playoff for bronze. Does anyone know the an… [+4715 chars]"
Stuff.co.nz,Stuff,Rugby World Cup final 2019: Could the All Blacks learn from Springboks' 'bomb squad's' six/two split?,"The South African ""bomb squad"" wreaked havoc on the England pack in a one-sided final in Japan.",https://www.stuff.co.nz/sport/rugby/rugby-world-cup/rwc-2019-japan/117129863/rugby-world-cup-final-2019-could-the-all-blacks-learn-from-springboks-bomb-squads-sixtwo-split,https://resources.stuff.co.nz/content/dam/images/1/x/q/d/s/i/image.related.StuffLandscapeSixteenByNine.1420x800.1xqhzb.png/1572746661499.jpg,2019-11-03T02:04:21Z,"Has Springboks coach Rassie Erasmus shown the All Blacks the way forward by packing his reserves bench with six forwards for South Africa's winning Rugby World Cup campaign?
 Erasmus believes his six-forwards/two backs split played a major part in the Spring… [+3633 chars]"
Mirror.co.uk,mirrornews@mirror.co.uk (Aaron Flanagan),Owen Farrell's celebration is a heartfelt gesture from England star for charity,Farrell links his index fingers and points them at the cameras after scoring points for England in the Rugby World Cup,https://www.mirror.co.uk/sport/rugby-union/owen-farrells-celebration-heartfelt-gesture-20748533,https://i2-prod.mirror.co.uk/incoming/article13970109.ece/ALTERNATES/s1200/0_Ireland-v-England-RBS-Six-Nations.jpg,2019-11-02T07:09:00Z,"Owen Farrell has a special celebration which involves linking both of his index fingers as he holds his hands in front of him.
The England rugby star directs the gesture towards the nearest TV camera or band of photographers every time that he scores in inte… [+1493 chars]"
Independent,"Samuel Lovett, Samuel Lovett",Rugby World Cup 2019: How Siya Kolisi's Springboks brought hope to troubled South Africa,The captain's ascent to the pinnacle of the sport speaks volume of the experiences endured by those of a certain colour in the country – but also points to what can be achieved in the face of adversity and tragedy,https://www.independent.co.uk/sport/rugby/rugby-union/international/rugby-world-cup-2019-south-africa-siya-kolisi-erasmus-race-unity-springboks-a9182671.html,https://static.independent.co.uk/s3fs-public/thumbnails/image/2019/11/02/18/pri94386348.jpg,2019-11-03T08:06:38Z,"It takes moments of true rarity and majesty for sport to transcend the perimeters of the pitch. They may seem fleeting, ephemeral in nature, but can often carry a legacy that burns bright in the pages of history. On Saturday night, with the Rugby World Cup at… [+9379 chars]"
ESPN Cric Info,,New Zealand plan to carry momentum of win into next T20 against England,Three-wicket star Mitchell Santner praises hosts' all-round improvement | ESPNcricinfo.com,https://www.espncricinfo.com/story/_/id/27995863/new-zealand-plan-carry-momentum-win-next-t20-england,https://a2.espncdn.com/combiner/i?img=%2Fi%2Fcricket%2Fcricinfo%2F1205528_1296x729.jpg,2019-11-03T09:49:02Z,"New Zealand plan to carry the momentum of a 21-run victory over England into their third T20I after a tough run for the host nation's sporting teams.
Questions about the All Blacks' semi-final defeat to England in Japan last weekend come heavily laden with a… [+3226 chars]"
Newsweek,Dan Cancian,"How to Watch Rugby World Cup Final: England vs. South Africa TV Channel, Live Stream and Odds","England and South Africa meet in the Rugby World Cup final for the first time since 2007, with the former looking for a second title since 2003 and the latter hoping to lift the trophy for a third time.",https://www.newsweek.com/watch-rugby-world-cup-england-south-africa-tv-channel-live-stream-odds-1468739,https://d.newsweek.com/en/full/1541840/england-south-africa-rugby-world-cup.jpg,2019-11-02T00:00:01Z,"A week is a long time in professional sports. Seven days ago, England was expected to become the latest addition in a list of illustrious victims New Zealand collected en route to a third Rugby World Cup final.
As it turned out, Eddie Jones' men didn't so mu… [+5048 chars]"
Japantoday.com,,Rugby World Cup's Asian legacy hinges on representation,"Rugby fever may have swept Japan during the seven weeks it hosted the World Cup but if the success of the tournament is to have a lasting effect around Asia, the rest of the continent is going to need some help. Over 54 million people, almost half the populat…",https://japantoday.com/category/rugby-world-cup-2019/rugby-world-cup%27s-asian-legacy-hinges-on-representation,,2019-11-03T22:00:16Z,"Rugby fever may have swept Japan during the seven weeks it hosted the World Cup but if the success of the tournament is to have a lasting effect around Asia, the rest of the continent is going to need some help.
Over 54 million people, almost half the popula… [+4013 chars]"
News24,,"News24.com | WATCH | 'I'm so proud of you, mission accomplished' - Siya Kolisi's childhood mentor","Springbok captain Siya Kolisi's childhood mentor could not contain his pride as he described South Africa's emphatic Rugby World Cup victory as ""mission accomplished"".",https://www.news24.com/SouthAfrica/News/watch-im-so-proud-of-you-mission-accomplished-siya-kolisis-childhood-mentor-20191103,http://cdn.24.co.za/files/Cms/General/d/230/9f920a86da444411b85cc7ad35cc927e.jpg,2019-11-03T06:02:23Z,"Springbok captain Siya Kolisi's childhood mentor could not contain his pride as he described South Africa's emphatic Rugby World Cup victory as ""mission accomplished"". 
Hundreds of fans gathered at Zwide Stadium to celebrate as their home town hero Kolisi li… [+1284 chars]"
Japantoday.com,,"No burden, no pressure as Erasmus steers Boks to victory","Of all the concepts and details covered in 618 days of meticulous planning for this moment, Rassie Erasmus regarded none as more important for his Springboks than context. Why are they at the Rugby World Cup? Who are they trying to win it for? Siya Kolisi, ap…",https://japantoday.com/category/rugby-world-cup-2019/no-burden-no-pressure-as-erasmus-steers-boks-to-victory,,2019-11-02T21:37:52Z,"Of all the concepts and details covered in 618 days of meticulous planning for this moment, Rassie Erasmus regarded none as more important for his Springboks than context.
Why are they at the Rugby World Cup? Who are they trying to win it for?
Siya Kolisi, … [+5115 chars]"
Channelnewsasia.com,CNA,Rugby: South Africa stick to coach Erasmus' gladitorial gameplan in absorbing World Cup final,"YOKOHAMA: South Africa coach Rassie Erasmus might have been criticised for his team's ""boring"" gameplan going into the Rugby World Cup final, but his side delivered perfectly with a dominant 32-12 victory over England on Saturday (Nov 2). In victory, the Spri…",https://www.channelnewsasia.com/news/sport/rugby-world-cup-final-south-africa-springboks-coach-erasmus-12057836,"https://cna-sg-res.cloudinary.com/image/upload/q_auto,f_auto/image/12057862/16x9/991/557/1b78f51b75e2e05ea07062966e8d4f68/zd/rassie-erasmus-lifts-trophy.jpg",2019-11-02T12:25:05Z,"YOKOHAMA: South Africa coach Rassie Erasmus might have been criticised for his team's ""boring"" gameplan going into the Rugby World Cup final, but his side delivered perfectly with a dominant 32-12 victory over England on Saturday (Nov 2).
In victory, the Spr… [+2907 chars]"
Stuff.co.nz,Stuff,England v South Africa: Skipper Siya Kolisi dedicates Rugby World Cup victory to back home,"First black Springboks captain completes fairytale journey to World Cup title: ""I've never seen South Africa like this"".",https://www.stuff.co.nz/sport/rugby/rugby-world-cup/rwc-2019-japan/117117738/england-v-south-africa-skipper-siya-kolisi-dedicates-rugby-world-cup-victory-to-back-home,https://resources.stuff.co.nz/content/dam/images/1/x/q/b/q/u/image.related.StuffLandscapeSixteenByNine.1420x800.1xq8mi.png/1572694859740.jpg,2019-11-02T11:40:53Z,"Springboks captain Siya Kolisi believed his side's Rugby World Cup victory would inspire the nation in a manner akin to South Africa's fabled 1995 success when Nelson Mandela presented the trophy to then captain Francois Pienaar after the Johannesburg final.… [+2676 chars]"
Mirror.co.uk,mirrornews@mirror.co.uk (Aaron Flanagan),Joe Marler's wife Daisy is the rock who ensured he played for England at Rugby World Cup,"Marler quit England duty just 12 months ago, but with the support of his wife, he reversed his decision and travelled to Japan",https://www.mirror.co.uk/sport/rugby-union/joe-marlers-wife-daisy-rock-20749634,https://i2-prod.mirror.co.uk/incoming/article20750085.ece/ALTERNATES/s1200/0_LCP_CHP_291019JoeMarlerWife_4374JoeMarlerWifeJPG.jpg,2019-11-02T07:13:00Z,"Joe Marler almost missed out on his chance to play in the Rugby World Cup Final.
Just twelves months ago, Marler announced that he would be walking away from England duty in order to spend some more time with his family.
Marler is happily married to long-te… [+2075 chars]"
Espn.com,,Rugby World Cup 2019: ESPN's Team of the Tournament,"With the dust settling on the Rugby World Cup, we assess the past six weeks of world-class rugby and its star performers.",https://www.espn.com/rugby/story/_/id/27996078/rugby-world-cup-2019-espn-team-tournament,https://a2.espncdn.com/combiner/i?img=%2Fphoto%2F2019%2F1103%2Fr622481_1296x729_16%2D9.jpg,2019-11-03T12:55:44Z,"TOKYO -- The Rugby World Cup is back in South Africa's hands after a phenomenal display against England in the final.
With the dust settling on the tournament, it is the perfect time to reflect on the past six weeks of world-class rugby and attempt to pick o… [+5706 chars]"
Freemalaysiatoday.com,AFP,Guardiola keen to learn from England Rugby World Cup coach Jones,Guardiola plans to watch England take on South Africa in Rugby World Cup final.,https://www.freemalaysiatoday.com/category/sports/2019/11/02/guardiola-keen-to-learn-from-england-rugby-world-cup-coach-jones/,https://s3media.freemalaysiatoday.com/wp-content/uploads/2019/11/pep-guardiola-AP021119.jpg,2019-11-02T00:44:54Z,"England rugby union coach Eddie Jones regards Guardiola as a major influence on his coaching methods. (AP pic)
MANCHESTER: Manchester City manager Pep Guardiola has extended an invitation to England rugby union coach Eddie Jones to visit him after the World … [+2502 chars]"
Stuff.co.nz,DUNCAN JOHNSTONE,Rugby World Cup failure places massive burden on next All Blacks coach,OPINION: Be warned whoever you are - NZ won't be so forgiving of another RWC disaster.,https://www.stuff.co.nz/sport/rugby/opinion/117136176/rugby-world-cup-failure-places-massive-burden-on-next-all-blacks-coach,https://resources.stuff.co.nz/content/dam/images/1/x/q/m/w/b/image.related.StuffLandscapeSixteenByNine.1420x800.1xqmuo.png/1572820001452.jpg,2019-11-03T22:26:39Z,"OPINION: The next All Blacks coach should be warned the New Zealand rugby public won't be so forgiving of another World Cup failure.
 With Steve Hansen's reign over the search starts for his successor.
 There's a long list of potential candidates for arguab… [+3813 chars]"
Worldsoccertalk.com,AFP,Springboks success timely boost for South African sport,Johannesburg (AFP) – Victory at the Rugby World Cup came as a huge relief to South African sport followers after a string of woeful performances by the national cricket and football teams. The Springboks used...,https://worldsoccertalk.com/2019/11/03/springboks-success-timely-boost-for-south-african-sport/,https://worldsoccertalk.com/wp-content/uploads/2019/11/c6ab97503b80e21de9178eae4610285bbfd2a832.jpg,2019-11-03T13:20:09Z,"Johannesburg (AFP) – Victory at the Rugby World Cup came as a huge relief to South African sport followers after a string of woeful performances by the national cricket and football teams.
The Springboks used forward power to subdue England, then let flying … [+2181 chars]"
Independent,"Maya Oppenheim, Maya Oppenheim",Head teacher suspended after pupil dresses as Hitler for Halloween,Image of pupil includes caption which alleges he was doing Nazi salutes 'in the face of the few minority children who attend the school',https://www.independent.co.uk/news/world/americas/hitler-halloween-costume-utah-creekside-elementary-school-a9182161.html,https://static.independent.co.uk/s3fs-public/thumbnails/image/2018/11/12/14/Adolf-Hitler-1940.jpg,2019-11-02T12:27:25Z,"The headteacher of a school in Utah has been suspended after one of their pupils was allowed to march in the schools Halloween parade while dressed up as Adolf Hitler.
Creekside Elementary School in Davis County has also suspended a teacher while they look i… [+23572 chars]"
Stuff.co.nz,HAMISH BIDWELL OF RNZ,"All Blacks need a revamp from stale, pale and male",OPINION: Sonny Bill Williams is right. It's time for a Pacific Island or Māori coach of the All Blacks.,https://www.stuff.co.nz/sport/rugby/opinion/117130819/all-blacks-need-a-revamp-from-stale-pale-and-male,https://resources.stuff.co.nz/content/dam/images/1/x/n/9/7/e/image.related.StuffLandscapeSixteenByNine.1420x800.1xqipv.png/1572749192986.jpg,2019-11-03T02:40:19Z,"This story was originally published on RNZ.co.nz and is republished with permission.
OPINION:Sonny Bill Williams is right. We're overdue for a Pacific Island or Mori coach of the All Blacks and not just in an assistant's or advisory role either.
 In the sam… [+5432 chars]"
Thejournal.ie,Hayley Halpin,Poll: Will you watch the Rugby World Cup final?,England are taking on South Africa in the final this morning.,https://www.thejournal.ie/rugby-world-cup-final-poll-4876473-Nov2019/,https://img2.thejournal.ie/article/4876473/river/?height=400&version=4876475,2019-11-02T09:05:39Z,"TheJournal.ie supports the work of the Press Council of Ireland and the Office of the Press Ombudsman, and our staff operate within the Code of Practice. You can obtain a copy of the Code, or contact the Council, at www.presscouncil.ie, PH: (01) 6489130, Lo-C… [+952 chars]"
Independent,"Maya Oppenheim, Maya Oppenheim",Hundreds of swingers evacuated from club after carbon monoxide alarm goes off,Around 10 complained they felt unwell and required treatment,https://www.independent.co.uk/news/world/europe/swingers-club-germany-evacuation-carbon-monoxide-alarm-hattingen-a9183441.html,https://static.independent.co.uk/s3fs-public/thumbnails/image/2019/11/03/16/istock-642295898.jpg,2019-11-03T16:54:18Z,"Hundreds of revellers at a swingers club in Germany were forced to evacuate after a carbon monoxide alarm went off.
Many guests at the party in the western town of Hattingen had to leave the premises in bathrobes.
Several said they did not feel well after t… [+22800 chars]"
The42.ie,Sean Farrell,"LIVE: England v South Africa, Rugby World Cup final","England are one game away from their second World Cup, South Africa are pushing for a third. Join us to see who gets their hands on the Webb Ellis.",https://www.the42.ie/live-latest-world-cup-final-4875190-Nov2019/,https://img2.thejournal.ie/article/4875190/river/?height=400&version=4875281,2019-11-02T08:00:27Z,"TheJournal.ie supports the work of the Press Council of Ireland and the Office of the Press Ombudsman, and our staff operate within the Code of Practice. You can obtain a copy of the Code, or contact the Council, at www.presscouncil.ie, PH: (01) 6489130, Lo-C… [+952 chars]"
Seattletimes.com,John Pye,Springboks ready for World Cup trophy tour of good hope,"YOKOHAMA, Japan (AP) — As black and white players hugged, danced and shared beer out of the Webb Ellis Cup, people across South Africa celebrated a Springboks world title for a third time. Almost a quarter-century after the first, defined by the iconic scene …",https://www.seattletimes.com/sports/springboks-ready-for-world-cup-trophy-tour-of-good-hope/,https://www.seattletimes.com/wp-content/themes/st_refresh/img/st-meta-facebook.png,2019-11-03T05:14:30Z,"YOKOHAMA, Japan (AP) As black and white players hugged, danced and shared beer out of the Webb Ellis Cup, people across South Africa celebrated a Springboks world title for a third time.
Almost a quarter-century after the first, defined by the iconic scene o… [+5206 chars]"
Stuff.co.nz,MARK REASON,"Mark Reason: Siya Kolisi and his men in green give the world hope, a mighty friend","OPINION: Some South Africans might, just might, feel a little less hungry if you feed them with hope.",https://www.stuff.co.nz/sport/rugby/rugby-world-cup/rwc-2019-japan/117130675/mark-reason-siya-kolisi-and-his-men-in-green-give-the-world-hope-a-mighty-friend,https://resources.stuff.co.nz/content/dam/images/1/x/q/a/t/6/image.related.StuffLandscapeSixteenByNine.1420x800.1xqilv.png/1572748689078.jpg,2019-11-03T02:38:09Z,"OPINION: Relentless, remorseless, ruthless.
 Yes, South Africa's World Cup victory was all of those powerfully physical things, but it was also far more than that. This triumph was spiritual. It came from deep within. It would be naive to think that winning … [+7127 chars]"
Independent,"Peter Stubley, Peter Stubley",British tourists among 33 injured after bus overturns in France,Flixbus flips onto its side in Somme region during journey from Paris to London,https://www.independent.co.uk/news/world/europe/bus-overturns-france-british-tourists-flixibus-a1-motorway-somme-a9183591.html,https://static.independent.co.uk/s3fs-public/thumbnails/image/2019/11/03/18/bus-crash-france.jpg,2019-11-03T19:03:03Z,"British tourists were among 33 people injured after a bus overturned in France on its way to London.
The Flixbus, which began its journey in Paris, flipped on to side on the A1 motorway in the northern Somme region on Sunday morning.
It was carrying passeng… [+23575 chars]"
Independent,,Julie Andrews told she was 'far too pretty' to play Mary Poppins by author Pamela Travers,Pamela Travers phoned just after the actress had given birth,https://www.independent.co.uk/arts-entertainment/films/news/julie-andrews-mary-poppins-pamela-travers-too-pretty-walt-disney-a9182776.html,https://static.independent.co.uk/s3fs-public/thumbnails/image/2019/11/01/11/gettyimages-168833835.jpg,2019-11-02T21:55:00Z,"Dame Julie Andrews has revealed that the author of Mary Poppins told her she was ""far too pretty"" for the role. 
The actress was in hospital following the birth of her daughter when she received a gruff phone call from Pamela Travers 
""She said: 'Well talk … [+23508 chars]"
Stuff.co.nz,RICHARD KNOWLER,England v South Africa: Springboks' scrum too brutal in RWC final for Englishmen,OPINION: It was brutal and beautiful. The Springboks delivered when it mattered in the World Cup final.,https://www.stuff.co.nz/sport/rugby/rugby-world-cup/rwc-2019-japan/117118033/england-v-south-africa-springboks-scrum-too-brutal-in-rwc-final-for-englishmen,https://resources.stuff.co.nz/content/dam/images/1/x/q/b/g/1/image.related.StuffLandscapeSixteenByNine.1420x800.1xq8up.png/1572692736752.jpg,2019-11-02T11:05:36Z,"OPINION: Hands up if you were really surprised by what unfolded at Yokohama Stadium?
 Come on, be honest. You knew all along this was going to be much more than two prizefighters slapping each other for all they were worth for 80 minutes.
 This was brutal a… [+4034 chars]"
BBC News,,'Kolisi and South Africa will inspire people far beyond the rugby pitch',"South Africa captain Siya Kolisi lifting the Webb Ellis Cup felt like something changing forever, writes BBC Sport chief sports writer Tom Fordyce.",https://www.bbc.co.uk/sport/rugby-union/50275155,https://ichef.bbci.co.uk/onesport/cps/624/cpsprodpb/174C6/production/_109503459_kolisiandramaphosa_afp.jpg,2019-11-02T16:20:08Z,"Media playback is not supported on this device
Watch key moments from South Africa's emphatic win over England
Sometimes a storm comes in and all you can do is yield in its path.
Heavy metal thunder on the pitch, the echoes of history off it. This was a So… [+6413 chars]"
BBC News,,Where it went wrong and what next for Jones - Dawson on England's World Cup final,"England will learn from final defeat but it will take time to pick themselves up, says World Cup winner Matt Dawson.",https://www.bbc.co.uk/sport/rugby-union/50276791,https://ichef.bbci.co.uk/onesport/cps/624/cpsprodpb/ECEF/production/_108855606_matt_dawson_columnist.png,2019-11-03T08:21:39Z,"England's World Cup final defeat against South Africa was desperately disappointing.
The way England have played at this World Cup and the depth of players they have as a group, this was absolutely the right squad to challenge for the trophy.
England fans w… [+6428 chars]"
Yahoo.com,"Editors, USA TODAY","Daylight saving time, World Series parade, National Sandwich Day: 5 things to know this weekend","Daylight saving time ends, the Washington Nationals celebrate their World Series in front of their fans and more things to get your weekend started.",https://news.yahoo.com/daylight-saving-time-world-series-074950317.html,https://s.yimg.com/ny/api/res/1.2/7DRBtDUG7WRcGmLnIf_bIw--/YXBwaWQ9aGlnaGxhbmRlcjt3PTEyODA7aD04NTIuMjY2NjY2NjY2NjY2Nw--/https://s.yimg.com/uu/api/res/1.2/1j49o5aZk.GWlUOKOm9TKg--~B/aD0yNzcyO3c9NDE2MTtzbT0xO2FwcGlkPXl0YWNoeW9u/https://media.zenfs.com/en-us/usa_today_news_641/6c9affd43dc72dabe98d7852be4beec4,2019-11-02T07:49:50Z,"Daylight saving time 2019 ends Sunday
Daylight saving time ends on Sunday at 2 a.m. which is the official hour to set all of our clocks back to standard time. But most of us will probably ""fall back"" before we go to bed Saturday night. That's unless you live… [+3328 chars]"
Yahoo.com,Entertainment Tonight,See Prince Harry's Perfect Response When a Young Student Calls Him Handsome,"The royal redhead also met with Japanese Paralympics hopefuls, showcased in a new clip.",https://ca.style.yahoo.com/see-prince-harry-apos-perfect-171801449.html,https://s.yimg.com/uu/api/res/1.2/hBynAjA7YW7wBGmIpI9b.g--~B/aD03MjA7dz0xMjgwO3NtPTE7YXBwaWQ9eXRhY2h5b24-/http://media.zenfs.com/en-US/homerun/etonline.tv/4c170d590c7b44953ac877af38206cad,2019-11-03T17:18:01Z,"During a recent overseas visit, some of Prince Harry's young fans couldn't keep their adoration to themselves.
The 35-year-old royal made his first official visit to Japan earlier this week, to attend the 2019 Rugby World Cup Finals between England and South… [+2245 chars]"
