source,author,title,description,url,urlToImage,publishedAt,content
Channelnewsasia.com,CNA,'Suck it up!' says Hansen as devastated All Blacks look forward,"New Zealand coach Steve Hansen admitted Sunday that a restless night's sleep had done little to numb the pain of their ""gut-wrenching"" 19-7 World Cup semi-final defeat by England.",https://www.channelnewsasia.com/news/sport/-suck-it-up---says-hansen-as-devastated-all-blacks-look-forward-12038782,"https://cna-sg-res.cloudinary.com/image/upload/q_auto,f_auto/image/12038780/16x9/991/557/e83bfc529a00488aa436471e036c1495/Dl/nothing-will-alleviate-the-pain-of-new-zealand-s-world-cup-semi-final-loss-to-england-says-all-blacks-coach-steve-hansen-1572158523995-2.jpg",2019-10-27T08:09:50Z,"TOKYO: New Zealand coach Steve Hansen admitted Sunday (Oct 27) that a restless night's sleep had done little to numb the pain of their ""gut-wrenching"" 19-7 World Cup semi-final defeat by England.
The treble-chasing All Blacks suffered only their second defea… [+2839 chars]"
Dailydot.com,Phil West,How to stream Arsenal vs. Crystal Palace,Arsenal's looking to reverse some bad Premier League luck. The post How to stream Arsenal vs. Crystal Palace appeared first on The Daily Dot.,https://www.dailydot.com/upstream/how-to-stream-arsenal-vs-crystal-palace-live/,https://www.dailydot.com/wp-content/uploads/2019/10/emirates-stadium-how-to-stream-arsenal-vs-crystal-palace-live.jpg,2019-10-27T03:30:03Z,"Its not a great time to be an Arsenal fan. But its not the worst time, as Thursdays come-from-behind victory in the Europa League illustrates. However, Mondays loss at Sheffield United was just the latest source of complaint for Arsenal fans discontent with t… [+2467 chars]"
Dailydot.com,Phil West,How to stream Manchester United vs. Norwich City,United ended Liverpool's quest for a perfect season. Are they now ready to turn it around? The post How to stream Manchester United vs. Norwich City appeared first on The Daily Dot.,https://www.dailydot.com/upstream/how-to-stream-manchester-united-vs-norwich-city-live/,https://www.dailydot.com/wp-content/uploads/2019/10/marcus-rashford-how-to-stream-manchester-united-vs-norwich-city-live.jpg,2019-10-27T03:30:28Z,"It was all going so well: Manchester United was set to give Liverpool its first loss of the season. Marcus Rashford scored late in the first half, and the defense held tough into the 85th minute. The good news for Unitedbut perhaps more for the rest of the le… [+2546 chars]"
Nzherald.co.nz,newsfeeds@nzherald.co.nz,English overcome 'fear of the All Blacks',"Rotorua rugby fans have their bets on England after the All Blacks were left licking their wounds in their Rugby World Cup semifinal. Bars playing the match were ""chocka"", including Hennessy's Irish...",https://www.nzherald.co.nz/rugby/news/article.cfm?c_id=80&objectid=12280095,https://www.nzherald.co.nz/resizer/0q_toO8QCvkx98IG3fR7YtEBStU=/1200x0/smart/filters:quality(70)/arc-anglerfish-syd-prod-nzme.s3.amazonaws.com/public/6H6MZUIO6NERXBNTOPNXI3C2EQ.jpg,2019-10-27T19:12:15Z,"Rotorua rugby fans have their bets on England after the All Blacks were left licking their wounds in their Rugby World Cup semifinal.
 Bars playing the match were ""chocka"", including Hennessy's Irish Bar, which had to turn away 100 people.
 Englishman Teren… [+2497 chars]"
Independent,"Jon Sharman, Jon Sharman",Woman dies in explosion at gender reveal party,Death is latest in string of safety incidents linked to craze,https://www.independent.co.uk/news/world/americas/gender-reveal-party-death-explosion-woman-iowa-knoxville-a9174621.html,https://static.independent.co.uk/s3fs-public/thumbnails/image/2019/10/28/15/knoxville-iowa.jpg,2019-10-28T15:47:32Z,"A woman was killed by an explosion during a gender reveal party in Iowa, according to US media reports.
CNN and ABC News both reported local law enforcement as confirming that a 56-year-old woman died after being struck by debris from the blast on Saturday.… [+22674 chars]"
Independent,"Alex Woodward, Alex Woodward",Trump shares photo of 'wonderful dog' in Isis operation - but says identity is still 'classified',The president says a Belgian Malinois assisted in the capture and death of Abu Bakr al-Baghdadi,https://www.independent.co.uk/news/world/americas/trump-dog-isis-twitter-al-baghdadi-classified-a9175236.html,https://static.independent.co.uk/s3fs-public/thumbnails/image/2019/10/28/16/trump-wonderful-dog-28-10-2019.jpeg,2019-10-28T21:18:44Z,"A picture of the ""wonderful dog"" that played a crucial role in the capture and death of Isis leader Abu Bakr al-Baghdadi was released in a tweet by Donald Trump, although the US president said the dog's name would remain classified.
Following his address at … [+22764 chars]"
Independent,"Peter Stubley, Peter Stubley","Far-right AfD surge to second place in German state election, beating Merkel's party","Anti-immigrant more than doubles share of vote to 23.5 per cent, say exit polls",https://www.independent.co.uk/news/world/europe/afd-germany-state-election-poll-latest-result-afd-merkel-thuringia-a9173746.html,https://static.independent.co.uk/s3fs-public/thumbnails/image/2019/10/27/23/hoecke-afd.jpg,2019-10-27T23:34:14Z,"The German far-right won a higher share of the vote than Angela Merkels party in a regional election on Sunday, according to exit polls.
Alternative for Germany (AfD) was forecast to come second in the poll in the state of Thuringia with 23.5 per cent, more … [+23161 chars]"
Ndtv.com,NDTVSports.com,Watch: England's Response To The Fearsome Haka Will Give You Goosebumps,Rugby World Cup: England players fought fire with fire and stared down New Zealand's fearsome haka during the blockbuster semi-final clash.,https://sports.ndtv.com/othersports/rugby-world-cup-englands-incredible-response-to-new-zealands-fearsome-haka-will-give-you-goosebumps--2123277,https://c.ndtvimg.com/2019-10/kfi13o7k_new-zealand-haka-vs-england-afp_625x300_27_October_19.jpg,2019-10-27T05:45:13Z,"New Zealand rugby team's haka, a traditional war-dance, is a menacing sight not just for the opposition but even for those sitting in the stadium or watching it on television. The hair-raising experience is arguably unmatched when it comes to intimidation in … [+1908 chars]"
Dailymail.co.uk,By Will Kelleher For The Daily Mail,Jonny Wilkinson says England are a more 'complete' side than his 2003 World Cup winners,"WILL KELLEHER IN TOKYO: While the side from 16 years ago are so revered in the nation's sporting psyche, the icon from that team believes Owen Farrell's side are playing on a different level.",https://www.dailymail.co.uk/sport/rugbyunion/article-7623431/Jonny-Wilkinson-says-England-complete-2003-World-Cup-winners.html,https://i.dailymail.co.uk/1s/2019/10/28/20/20295574-0-image-a-33_1572293209588.jpg,2019-10-28T22:01:40Z,"Jonny Wilkinson thinks Eddie Jones England are a more complete side than his 2003 World Cup heroes.
While the side from 16 years ago are so revered in the nations sporting psyche, the icon from that team believes Owen Farrells side are playing on a different… [+4677 chars]"
Japantimes.co.jp,Rebecca Saunders,Former All Black Luke McAlister gives Japanese rugby a try,"Now decked out in all blue, New Zealand-born rugby player Luke McAlister is giving the Shimizu Blue Sharks a taste of Kiwi sportsmanship — which includes post-game drinks.",https://www.japantimes.co.jp/community/2019/10/27/our-lives/former-black-luke-mcalister-gives-japanese-rugby-try/,https://cdn.japantimes.2xx.jp/wp-content/uploads/2019/10/p09-saunders-lukemcalister-c-20191028-870x580.jpg,2019-10-27T09:30:11Z,"Japan’s love of rugby may have taken a slight hit after the national team’s loss to South Africa last week in the Rugby World Cup quarterfinals, but the tournament has let fans here discover new teams to root for, New Zealand in particular.
“I got into the a… [+8185 chars]"
Dailymail.co.uk,By Sir Clive Woodward for the Daily Mail,"Rugby World Cup 2019: By every measure, this was England's greatest ever performance","SIR CLIVE WOODWARD: Was Saturday's World Cup semi-final win over New Zealand England's greatest ever performance? Yes, unquestionably, would be my answer.",https://www.dailymail.co.uk/sport/rugbyunion/article-7619775/Rugby-World-Cup-2019-measure-Englands-greatest-performance.html,https://i.dailymail.co.uk/1s/2019/10/27/21/20255654-0-image-a-35_1572210519291.jpg,2019-10-27T22:31:15Z,"Was Saturdays sensational World Cup semi-final win over New Zealand Englands greatest ever performance? Yes, unquestionably, would be my answer.
Great teams and great performances are only possible when you have special players working in tandem and what you… [+6742 chars]"
Freemalaysiatoday.com,AFP,"NZ players had ‘bulletproof vests’ on for semi post-mortem, says Williams",All Blacks icon reveals brutal nature of game review after World Cup defeat by England.,https://www.freemalaysiatoday.com/category/sports/2019/10/28/nz-players-had-bulletproof-vests-on-for-semi-post-mortem-says-williams/,https://s3media.freemalaysiatoday.com/wp-content/uploads/2018/09/sonny-bill-williams-9-sep.jpg,2019-10-28T07:04:45Z,"Williams is itching to play Wales in the third-place playoff. (AFP pic)
TOKYO: New Zealand icon Sonny Bill Williams said today that the All Blacks players needed “bulletproof vests” during a brutal analysis of their devastating 19-7 World Cup semifinal defea… [+2872 chars]"
Nzherald.co.nz,newsfeeds@nzherald.co.nz,Bring on the Poms! Boks sink Wales in World Cup classic,"Twelve years on, South Africa and England will meet again in a Rugby World Cup final. The Springboks have moved into their third World Cup finale, holding off a valiant effort from Wales to advance...",https://www.nzherald.co.nz/sport/news/article.cfm?c_id=4&objectid=12280176,https://www.nzherald.co.nz/resizer/55RQHQujdy666PfQqxC75V0ftwQ=/1200x0/smart/filters:quality(70)/arc-anglerfish-syd-prod-nzme.s3.amazonaws.com/public/2WFZLXBX4FDORCRV2YEC6MDD2U.jpg,2019-10-27T11:22:48Z,"Twelve years on, South Africa and England will meet again in a Rugby World Cup final.
 The Springboks have moved into their third World Cup finale, holding off a valiant effort from Wales to advance, winning 19-16 thanks to a late Handre Pollard penalty.
 E… [+2760 chars]"
Stuff.co.nz,Stuff,Rugby World Cup 2019: Warren Gatland hailed as the best test coach of his generation ahead of 'monumental' All Blacks clash,"Kiwi coach knows the All Blacks are ""hurting as much as Wales'', but is still determined to get his first win against them.",https://www.stuff.co.nz/sport/rugby/rugby-world-cup/rwc-2019-japan/116966575/rugby-world-cup-2019-warren-gatland-hailed-as-the-best-test-coach-of-his-generation-ahead-of-monumental-all-blacks-clash,https://resources.stuff.co.nz/content/dam/images/1/x/n/0/3/6/image.related.StuffLandscapeSixteenByNine.1420x800.1xmzzj.png/1572198916111.jpg,2019-10-27T17:55:16Z,"Warren Gatland - hailed by an influential English newspaper as the best rugby coach of his generation - has talked about his desire to beat the All Blacks for the first time in his final game as Wales coach.
 Wales' World Cup title dream ended on Sunday in a… [+4204 chars]"
Independent.ie,Jonathan Bradley,'Make sure he enjoys the 3rd/4th place playoff' - Eddie Jones enjoys one final swipe at Warren Gatland,"ENGLAND coach Eddie Jones has had one final swipe at Warren Gatland, wishing the departing Wales coach well in the third/fourth play-off on Friday.",https://www.independent.ie/sport/rugby/rugby-world-cup-2019/make-sure-he-enjoys-the-3rd4th-place-playoff-eddie-jones-enjoys-one-final-swipe-at-warren-gatland-38636919.html,https://www.independent.ie/incoming/article38636918.ece/ALTERNATES/h342/GettyImages-1126868967.jpg,2019-10-28T08:40:29Z,"ENGLAND coach Eddie Jones has had one final swipe at Warren Gatland, wishing the departing Wales coach well in the third/fourth play-off on Friday.
Wales will battle it out with the All Blacks for World Cup bronze after they were beaten by South Africa on Su… [+3147 chars]"
Dailymail.co.uk,By Chris Foy for the Daily Mail,Chris Foy's Rugby World Cup semi final verdict: England's 'V' response to the Haka was golden,England's emphatic semi final victory over the all-conquering New Zealand was not without its talking points. Sportsmail's Chris Foy breaks down this weekend's most talked about moments.,https://www.dailymail.co.uk/sport/rugbyunion/article-7619783/Chris-Foys-Rugby-World-Cup-semi-final-verdict-Englands-V-response-Haka-golden.html,https://i.dailymail.co.uk/1s/2019/10/27/21/20255994-0-image-a-102_1572211633461.jpg,2019-10-27T22:30:17Z,"England's emphatic semi final victory over the all-conquering New Zealand was not without its talking points.
Eddie Jones' side saw off the reigning world champions 19-7 in what was, on balance, a comfortable win at the Yokohama Stadium.
Sportsmail's Chris … [+2532 chars]"
Nzherald.co.nz,newsfeeds@nzherald.co.nz,"All Blacks' mana undimmed, grief will pass: expert","""Yes, we're disappointed, but it's time to share the Cup around."" That's how one expert believes New Zealanders are reacting to the All Blacks' unexpected loss to England. Professor Toni Bruce, a sociologist...",https://www.nzherald.co.nz/sport/news/article.cfm?c_id=4&objectid=12280145,https://www.nzherald.co.nz/resizer/2RleyCptqlYIqwXRd8Wvqzsfwc8=/1200x0/smart/filters:quality(70)/arc-anglerfish-syd-prod-nzme.s3.amazonaws.com/public/5JNWGUIIAVFDRD2V3346XGED3U.jpg,2019-10-27T16:10:23Z,"""Yes, we're disappointed, but it's time to share the Cup around.""
 That's how one expert believes New Zealanders are reacting to the All Blacks' unexpected loss to England.
 Professor Toni Bruce, a sociologist of sport at the University of Auckland, has sur… [+3841 chars]"
RTE,Jonny Holland,Maybe the game needs England to go all the way,Jonny Holland casts his eye over two very different Rugby World Cup semi-finals and asks: would the game be better for an English win in the final?,https://www.rte.ie/sport/rugby/2019/1028/1086102-maybe-the-game-needs-england-to-go-all-the-way/,https://img.rasset.ie/00109d5e-1600.jpg,2019-10-28T17:13:24Z,"The two semi-finals of the World Cup showed us the best and worst of rugby, contrasting a ferociously paced contest with offloads and an attacking flair versus a kicking stalemate with very slow ball.
England have been on the rise since beating Ireland in Du… [+6093 chars]"
Nzherald.co.nz,newsfeeds@nzherald.co.nz,Simon Wilson: All Blacks and outrageous arrows of English fortune,"COMMENT: In the end they ran, each man among them, one then the other, again and again at the foe, and each was repelled but the next rose for the challenge, and ran, and was repelled, until there was...",https://www.nzherald.co.nz/sport/news/article.cfm?c_id=4&objectid=12280102,https://www.nzherald.co.nz/resizer/3h36RflF3LEcK4rNSRtcZCEnshM=/1200x0/smart/filters:quality(70)/arc-anglerfish-syd-prod-nzme.s3.amazonaws.com/public/JSUJLZ7UIJCKZFRCCDGIPI4S5M.jpg,2019-10-27T16:10:23Z,"COMMENT:
 In the end they ran, each man among them, one then the other, again and again at the foe, and each was repelled but the next rose for the challenge, and ran, and was repelled, until there was no more running to be done.
 Afterwards they slumped to… [+5185 chars]"
Dailydot.com,Phil West,How to stream Liverpool vs. Tottenham Hotspur,"Liverpool may have lost its bid for a perfect season, but the undefeated dream is still alive. Will it remain after facing Tottenham Hotspur on Sunday?",https://www.dailydot.com/upstream/how-to-stream-liverpool-vs-tottenham-hotspur-live/,https://www.dailydot.com/wp-content/uploads/2019/10/mohamed-salah-how-to-stream-liverpool-vs-tottenham-hotspur.jpg,2019-10-27T03:30:27Z,"Liverpools quest for a perfect season came to an end last weekend at Old Trafford, but an Adam Lallana equalizer with less than six minutes left in regulation kept the undefeated dream alive. Itll be another stern test for the Reds on Sunday, though. Itll be … [+6738 chars]"
Nzherald.co.nz,newsfeeds@nzherald.co.nz,Kate Hawkesby: Why Mike Hosking is 'to blame' for All Blacks World Cup loss,"COMMENT: I feel my husband is responsible for the ABs' loss against England.He was due to fly out to Japan yesterday morning for a week of shows this week, building up to the grand final.But by Saturday afternoon he still hadn't...",https://www.nzherald.co.nz/nz/news/article.cfm?c_id=1&objectid=12280346,https://www.nzherald.co.nz/resizer/yaCe6v2Hltd8UUVnwUvadfkbHhk=/1200x0/smart/filters:quality(70)/arc-anglerfish-syd-prod-nzme.s3.amazonaws.com/public/EXSSBOXBS5FMVO5F64KEEIPR3A.jpg,2019-10-28T18:23:06Z,"COMMENT:
 I feel my husband is responsible for the ABs' loss against England.
 He was due to fly out to Japan yesterday morning for a week of shows this week, building up to the grand final.
 But by Saturday afternoon he still hadn't dug out a suitcase or … [+2485 chars]"
Dailymail.co.uk,By Paul Bracchi for the Daily Mail,PAUL BRACCHI looks back at the childhood of England rugby hero Manu Tuilagi,PAUL BRACCHI: England rugby star Manu Tuilagi wowed the World Cup crowds in Japan on Saturday by scoring a try in the second minute.,https://www.dailymail.co.uk/news/article-7619959/PAUL-BRACCHI-looks-childhood-England-rugby-hero-Manu-Tuilagi.html,https://i.dailymail.co.uk/1s/2019/10/27/22/20257896-0-image-a-23_1572215884713.jpg,2019-10-27T23:09:19Z,"Manu Tuilagi is pictured above with partner Chantelle Garrity. As for Manu himself, in the early days he developed something of a bad boy, macho reputation which even threatened his career
Few Britons have probably heard of Fatausi-Fogapoa. 
The map tells u… [+8644 chars]"
Dailymail.co.uk,By Rod Ardehali For Mailonline,England rugby fan on crutches books £650 flight to Tokyo while 'four or five pints down',"Rob Lewis, from Sunbury-on-Thames, who describes himself as 'elite bandwagon' looked up flights after a boozy morning with friends watching England's semi-final victory on Saturday.",https://www.dailymail.co.uk/news/article-7621403/England-rugby-fan-crutches-books-650-flight-Tokyo-four-five-pints-down.html,https://i.dailymail.co.uk/1s/2019/10/28/11/20275886-0-image-a-36_1572261248304.jpg,2019-10-28T11:18:53Z,"A rugby fan who booked flights to Tokyo 'four or five pints down' after watching England's win over New Zealand is poised to arrive in Japan on crutches with no accommodation and no ticket to the World Cup final.
Rob Lewis, a web designer from Sunbury-on-Tha… [+3074 chars]"
Mirror.co.uk,mirrornews@mirror.co.uk (Alex Spink),England 19-7 New Zealand: Brilliant England turn rugby 'gods' into mere mortals,Eddie Jones' men produce greatest ever Rugby World Cup display by an England team to set up final against either Wales or South Africa,https://www.mirror.co.uk/sport/rugby-union/england-19-7-new-zealand-20734153,https://i2-prod.mirror.co.uk/incoming/article20728649.ece/ALTERNATES/s1200/0_Rugby-World-Cup-Semi-Final-England-v-New-Zealand.jpg,2019-10-27T02:08:50Z,"Owen Farrell and his England heroes stormed into the final of the Rugby World Cup - then promised the best is still to come.
An astonishing mix of power, pace and precision allied to suffocating defence saw England crush the two-time defending champions in Y… [+3672 chars]"
Stuff.co.nz,Stuff,Laurie Mains says next All Blacks coach 'has to have experienced adversity',"Ex-All Blacks coach says Steve Hansen's successor must know how to ""build or rebuild a team''.",https://www.stuff.co.nz/sport/rugby/all-blacks/116981798/laurie-mains-says-next-all-blacks-coach-has-to-have-experienced-adversity,https://resources.stuff.co.nz/content/dam/images/1/w/w/w/6/g/image.related.StuffLandscapeSixteenByNine.1420x800.1xnbqe.png/1572295820702.jpg,2019-10-28T20:42:47Z,"Laurie Mains has mentioned Jamie Joseph, Scott Robertson and Dave Rennie as possible All Blacks coaching contenders but says the next coach needs to ""have experienced adversity"".
 Mains, who coached the All Blacks team to an extra-time defeat in the 1995 Rug… [+3266 chars]"
Independent.ie,Independent.ie Newsdesk,Warren Gatland rues penalty count as Wales are beaten at the death by South Africa,Wales coach Warren Gatland admitted his side paid the price for conceding too many penalties as they suffered an agonising 19-16 defeat to South Africa in their World Cup semi-final.,https://www.independent.ie/sport/rugby/rugby-world-cup-2019/warren-gatland-rues-penalty-count-as-wales-are-beaten-at-the-death-by-south-africa-38635031.html,https://www.independent.ie/incoming/article38635029.ece/ALTERNATES/h342/warren.jpg,2019-10-27T13:06:38Z,"Wales coach Warren Gatland admitted his side paid the price for conceding too many penalties as they suffered an agonising 19-16 defeat to South Africa in their World Cup semi-final.
The Springboks will face England in next Saturday's final following fly-hal… [+2371 chars]"
Mirror.co.uk,mirrornews@mirror.co.uk (Paul Grayson),Paul Grayson column: England gave us close to perfection - it feels like there's more to come,England reached the Rugby World Cup final with a spectacular performance against the All Blacks - and they aren't finished yet,https://www.mirror.co.uk/sport/rugby-union/paul-grayson-column-england-gave-20735914,https://i2-prod.mirror.co.uk/incoming/article20735955.ece/ALTERNATES/s1200/0_England-v-New-Zealand-Rugby-World-Cup-2019-Semi-Final.jpg,2019-10-27T17:00:00Z,"We asked for perfection and England gave us something close to it. In pure performance terms I cant think of another English World Cup performance that was so comprehensive against such a good team.
Now place it in the context of competition and where in the… [+3106 chars]"
RTE,RTÉ Sport,Vunipola: England's early impact on New Zealand was key,"Billy Vunipola has revealed that England wanted to ""shock"" New Zealand in the opening 20 minutes of their unforgettable World Cup semi-final performance.",https://www.rte.ie/sport/rugby/2019/1027/1085967-vunipola-englands-early-impact-on-new-zealand-was-key/,https://img.rasset.ie/0012ebe4-1600.jpg,2019-10-27T15:46:22Z,"Billy Vunipola has revealed that England wanted to ""shock"" New Zealand in the opening 20 minutes of their unforgettable World Cup semi-final performance.
Centre Manu Tuilagi set the tone with a try after just 97 seconds, and then it was virtually mistake-fre… [+2857 chars]"
Dailymail.co.uk,By Chris Foy for the Daily Mail,"Making Owen Farrell the skipper, calling up Tom Curry...how Eddie Jones made his side WORLD BEATERS","The Greatest English Test victory of all time was born amid the wreckage of the only major losing run of the Eddie Jones era. Six defeats in a row became the catalyst for an epic, historic feat.",https://www.dailymail.co.uk/sport/rugbyunion/article-7619577/Making-Owen-Farrell-skipper-calling-Tom-Curry-Eddie-Jones-WORLD-BEATERS.html,https://i.dailymail.co.uk/1s/2019/10/27/19/20252906-0-image-a-39_1572205076167.jpg,2019-10-27T22:30:42Z,"The Greatest English Test victory of all time was born amid the wreckage of the only major losing run of the Eddie Jones era. Six defeats in a row became the catalyst for an epic, historic feat.
In the aftermath of Saturdays stunning annihilation of the fabl… [+7513 chars]"
Dailymail.co.uk,By Richard Kay for the Daily Mail,RICHARD KAY details the unlikely sporting journey of heroic rugby coach Eddie Jones,RICHARD KAY: As a schoolboy the fortunes of his under-13 side often rested on the cunning of Eddie Jones. On Saturday a nation will be praying that same crafty skill will bring England victory.,https://www.dailymail.co.uk/news/article-7623663/RICHARD-KAY-details-unlikely-sporting-journey-heroic-rugby-coach-Eddie-Jones.html,https://i.dailymail.co.uk/1s/2019/10/28/21/20299318-0-image-a-43_1572298310059.jpg,2019-10-28T22:00:53Z,"As a schoolboy the fortunes of his under-13 side often rested on the cunning of Eddie Jones (pictured in Tasmania) 
As a schoolboy the fortunes of his under-13 side often rested on the cunning of Eddie Jones. The smallest boy in the side, he was also the bra… [+6453 chars]"
Mirror.co.uk,mirrornews@mirror.co.uk (Darren Wells),England fan drunkenly buys flights to Rugby World Cup Final - but not tickets or hotel,The boozy supporter will be hobbling around on crutches when he lands in Japan due to a recent knee op,https://www.mirror.co.uk/sport/rugby-union/england-fan-drunkenly-buys-flights-20742905,https://i2-prod.mirror.co.uk/incoming/article20742908.ece/ALTERNATES/s1200/0_Rugby-World-Cup-final-2019.jpg,2019-10-28T14:21:25Z,"An England rugby fan has forked out £650 for a flight to Japan for the World Cup final after booking the trip when he was ""four of five pints down"". 
 Rob Lewis from Sunbury-on-Thames had sunk a few drinks while watching England's semi-final win over New Zea… [+1790 chars]"
The42.ie,Kevin O'Brien,'I'm just trying to learn and get better. I don't think I deserve to have any other opinion on myself',Jonny Cooper discusses the  Masters he’s doing in behaviour psychology and his plans to visit some professional teams during the off-season.,https://www.the42.ie/jonny-cooper-off-season-plans-masters-dcu-4867152-Oct2019/,https://img2.thejournal.ie/article/4867152/river/?height=400&version=4867600,2019-10-28T07:00:44Z,"FOR THE FIRST time since the start of the year, Jonny Cooper has a bit of free time on his hands. 
Jonny Cooper was speaking at the launch of DCU and Na Fianna's new seven-year community partnership.
The inter-county campaign is firmly in the rearview mirro… [+10487 chars]"
