source,author,title,description,url,urlToImage,publishedAt,content
Dailymail.co.uk,By Rianne Addo For Mailonline,"Try Star's Thom Evans, Ben Foden and Levi Davis leave studio after rehearsals for Celeb X Factor","Rugby players Thom, Ben, both 34, and Levi, 21, geared up for their upcoming second appearance on the X Factor: Celebrity stage as they left a recording studio   in London on Wednesday.",https://www.dailymail.co.uk/tvshowbiz/article-7634627/Try-Stars-Thom-Evans-Ben-Foden-Levi-Davis-leave-studio-rehearsals-Celeb-X-Factor.html,https://i.dailymail.co.uk/1s/2019/10/31/10/20419258-0-image-a-4_1572518436774.jpg,2019-10-31T11:13:04Z,"They left the judges in awe as they kicked off their first live show with a mash-up of Ginuwine's Pony and Lil Nas X's Old Town Road.  
And Try Star's Thom Evans, Ben Foden and Levi Davis geared up for their upcoming second appearance on the X Factor: Celebr… [+3423 chars]"
News24,,News24.com | Zelda la Grange to Madiba: 'I can hear your voice loud and clear…',"In a letter to former president Nelson Mandela, his former personal assistant Zelda le Grange tells him about her excitement for the Rugby World Cup final, when the most representative team from South Africa to ever play for the cup faces England. ""Your words…",https://www.news24.com/Columnists/GuestColumn/zelda-la-grange-to-madiba-i-can-hear-your-voice-loud-and-clear-20191031,http://cdn.24.co.za/files/Cms/General/d/9543/1ec0e42dea594d218e1aec3f0a43e220.jpg,2019-10-31T14:08:20Z,"Ahhh Dalibunga!!!
Dear Khulu,
I greet your ancestors and acknowledge them. We need all the strength.  
Summer is here and we are broke.
Yes, South Africa remains the country of the most extreme contrasts; of good and bad all simmering in the same pot.
Bi… [+7186 chars]"
Stuff.co.nz,ROBBIE DEANS,"Robbie Deans: Great players embrace the anxiety, and use it to face the challenge","OPINION: Enjoy the RWC final ride, it is unlikely to disappoint.",https://www.stuff.co.nz/sport/rugby/rugby-world-cup/rwc-2019-japan/117083865/robbie-deans-great-players-embrace-the-anxiety-and-use-it-to-face-the-challenge,https://resources.stuff.co.nz/content/dam/images/1/x/p/j/d/8/image.related.StuffLandscapeSixteenByNine.1420x800.1xpihl.png/1572563126494.jpg,2019-10-31T23:05:26Z,"OPINION: One of the most common questions coaches get asked is what do the players think about in the lead-up to crucial games, and what is going through their heads as they run out the tunnel?
 It's a critical ingredient in any high pressure situation. It i… [+3904 chars]"
Theconversation.com,"Mikel Mellick, Seni​or Lecturer in Athlete Mental Health, Cardiff Metropolitan University",Rugby referees are quitting. It's time to show some compassion,One of the most pressurised roles in the pressure cooker that is the Rugby World Cup is the referee. Threatening fans are causing them to quit the game at all levels.,http://theconversation.com/rugby-referees-are-quitting-its-time-to-show-some-compassion-126045,https://images.theconversation.com/files/299452/original/file-20191030-17893-1qk235x.jpg?ixlib=rb-1.1.0&q=45&auto=format&w=1356&h=668&fit=crop,2019-10-31T10:12:14Z,"MARK R. CRISTINO/EPA Rugby, like all sports, likes to talk about players and coaches “dying by the sword”. This kind of pressure has been ever-present during the Rugby World Cup 2019 in Japan. Referees in particular felt the heat with the sport’s global gover… [+5150 chars]"
BBC News,,England cannot be complacent against South Africa - Johnson,World Cup-winning captain Martin Johnson says England must not be trapped into thinking a repeat of their semi-final performance will be enough against South Africa.,https://www.bbc.co.uk/sport/rugby-union/50246269,https://ichef.bbci.co.uk/onesport/cps/624/cpsprodpb/980F/production/_109472983_johnson_getty.jpg,2019-10-31T08:18:57Z,"England's Class of 2003 spoke on the BBC Radio 5 Live Rugby Union Weekly
World Cup-winning captain Martin Johnson says England must not be trapped into thinking a repeat of their semi-final performance will be enough to make them world champions on Saturday.… [+5362 chars]"
Channelnewsasia.com,CNA,Williams welcomes World Cup return of rugby's smaller men,Shane Williams once looked like the last of the dying breed as a smaller man in the game of rugby and the Wales and British and Irish Lions winger has been delighted by the re-emergence of the diminutive back at this World Cup.,https://www.channelnewsasia.com/news/sport/williams-welcomes-world-cup-return-of-rugby-s-smaller-men-12048136,"https://cna-sg-res.cloudinary.com/image/upload/q_auto,f_auto/image/12048134/16x9/991/557/453eef4a8eec2cadf05d1f7872035ccc/FD/file-photo--wales--williams-runs-to-score-a-try-against-australia-during-their-friendly-rugby-international-test-match-at-the-millennium-stadium-in-cardiff-6.jpg",2019-10-30T10:37:34Z,"TOKYO: Shane Williams once looked like the last of the dying breed as a smaller man in the game of rugby and the Wales and British and Irish Lions winger has been delighted by the re-emergence of the diminutive back at this World Cup.
Williams, who stands 5f… [+2917 chars]"
BBC News,,Rugby World Cup final: The six key battles to decide the World Cup - Matt Dawson column,"South Africa's style will not work against England but I think they are going to bring something different, says World Cup winner Matt Dawson.",https://www.bbc.co.uk/sport/rugby-union/50246735,https://ichef.bbci.co.uk/onesport/cps/624/cpsprodpb/ECEF/production/_108855606_matt_dawson_columnist.png,2019-10-31T14:13:37Z,"<table><tr><th>Rugby World Cup final: England v South Africa</th></tr>
<tr><td>Venue: Yokohama International Stadium Date: Saturday, 2 November Kick-off: 09:00 GMT</td></tr><tr><td>Coverage: Live radio commentary on BBC Radio 5 Live and live text commentary … [+5469 chars]"
Japantoday.com,,Read to lead All Blacks for last time in third-place playoff game against Wales,"Kieran Read, Sonny Bill Williams and Ben Smith will get their farewell tests in All Blacks jerseys in a reshuffled New Zealand squad to play Wales in the third-place playoff at the Rugby World Cup. The All Blacks were on track for a third consecutive title un…",https://japantoday.com/category/rugby-world-cup-2019/read-to-lead-all-blacks-for-last-time-in-bronze-game-v-wales,,2019-10-30T03:44:18Z,"Kieran Read, Sonny Bill Williams and Ben Smith will get their farewell tests in All Blacks jerseys in a reshuffled New Zealand squad to play Wales in the third-place playoff at the Rugby World Cup.
The All Blacks were on track for a third consecutive title u… [+2410 chars]"
Independent,"Samuel Osborne, Samuel Osborne",Meghan Murphy: Hundreds protest outside Toronto Public Library as feminist gives talk on transgender rights,"'Hosting transphobic speakers that promote intolerance in Canadian society is damaging,' transgender writer says",https://www.independent.co.uk/news/world/americas/meghan-murphy-transgender-protest-toronto-public-library-a9177601.html,https://static.independent.co.uk/s3fs-public/thumbnails/image/2019/10/30/13/meghan-murphy.jpg,2019-10-30T15:47:11Z,"Hundreds of people protested outside a library in Toronto which hosted an event featuring a feminist speaker with controversial views on transgender rights.
Meghan Murphy's talk at the Toronto Public Library's Palmerston branch on Tuesday night drew a crowd … [+23358 chars]"
Independent.ie,Ruaidhri O'Connor in Tokyo,Ruaidhri O'Connor: 'How long can new-found love affair between the neutral and the English rugby team last?',"HOW long will it last, this new-found love affair between the neutral and the English rugby team?",https://www.independent.ie/sport/rugby/rugby-world-cup-2019/ruaidhri-oconnor-how-long-can-newfound-love-affair-between-the-neutral-and-the-english-rugby-team-last-38650483.html,https://www.independent.ie/incoming/article38650479.ece/ALTERNATES/h342/RUGBYU-E-367.jpg,2019-10-31T22:00:00Z,"For many, an English exit from a big tournament is one of life's great pleasures. No matter how we convince ourselves we've matured as a nation, the sight of the latest penalty shoot-out collapse or pool stage capitulation brings out a certain sense of glee i… [+6350 chars]"
Independent,"Zamira Rahim, Zamira Rahim",Female teacher jailed after having sex with schoolboy,"'She abused her position of trust and authority,' judge says in sentencing remarks",https://www.independent.co.uk/news/world/europe/teacher-sex-pupil-jail-dublin-circuit-criminal-court-ireland-student-a9179481.html,https://static.independent.co.uk/s3fs-public/thumbnails/image/2019/10/31/14/dublin-circuit-criminal-court.jpg,2019-10-31T16:55:24Z,"A former teacher who had sex with her 16-year-old pupil has been sentenced to three years in prison, with the last two suspended.
She pleaded guilty to two counts of defilement at Dublin Crown Court in March 2018 and was disqualified as a teacher.
The woman… [+23200 chars]"
Independent,"Samuel Osborne, Samuel Osborne","Body of Thai millionaire businesswoman found in her fridge, triggering manhunt",Authorities searching for man allegedly seen driving murdered property developer's car,https://www.independent.co.uk/news/world/asia/millionaire-businesswoman-body-fridge-found-chiang-mai-thailand-wannee-jiracharoenying-withun-a9177391.html,https://static.independent.co.uk/s3fs-public/thumbnails/image/2019/10/30/11/thailand-fridge-murder.jpg,2019-10-30T12:09:19Z,"The body of a Thai millionaire businesswoman has been found entombed in concrete in her fridge.
Wannee Jiracharoenying, 58, went missing in October after going to visit her local temple.
Ms Wannee was found after neighbours complained about an unpleasant sm… [+22633 chars]"
Independent,"Travel desk, Travel desk",Russian actor dragged off flight after calling other passengers 'plebs',"'I'm an actress and you are a pleb. Because you probably bought the ticket with miles,' says Lidiya Velezheva",https://www.independent.co.uk/travel/news-and-advice/russia-flight-actress-plebs-lidiya-velezheva-video-aeroflot-moscow-a9178891.html,https://static.independent.co.uk/s3fs-public/thumbnails/image/2019/10/31/11/lidia.png,2019-10-31T11:34:00Z,"A Russian actor was dragged off a plane when she called other passengers plebs.
Actor Lidiya Velezheva was in business class onboard an Aeroflot flight from Moscow to Tel Aviv.
Just before take-off, she became agitated and flew into a rage, according to mul… [+23278 chars]"
Independent,"Roisin O'Connor, Roisin O'Connor",Kevin Spacey sexual assault case dropped after accuser dies,Actor was accused of groping the anonymous masseur during a session in 2016,https://www.independent.co.uk/arts-entertainment/films/news/kevin-spacey-sexual-assault-case-death-accuser-massage-therapist-a9177121.html,https://static.independent.co.uk/s3fs-public/thumbnails/image/2019/07/06/15/spacey-court.jpg,2019-10-30T08:35:06Z,"Kevin Spacey will not be charged with sexual assault after the man who accused him died unexpectedly. 
The decision was announced by the LA County District Attorneys office this week. The accuser was an anonymous masseur who claimed Spacey forced him to touc… [+22452 chars]"
Independent,"John Rentoul, John Rentoul",Even the Tories aren't ready to fight a general election. Boris Johnson starts his campaign with his party divided,The prime minister is struggling to convince his own MPs – as well as voters – that this election was strictly necessary to deliver Brexit,https://www.independent.co.uk/voices/boris-johnson-general-election-brexit-tories-fight-a9177386.html,https://static.independent.co.uk/s3fs-public/thumbnails/image/2019/10/28/19/front-boris-johnson-28-october-5.jpg,2019-10-30T12:12:44Z,"I asked a Conservative MP if he was looking forward to the election and he did that thing which is surprisingly difficult, of saying Yes cheerfully and shaking his head.
This is the election that no one wants. Two thirds of MPs voted for it, paradoxically. T… [+21750 chars]"
Independent,"Caroline Lucas, Caroline Lucas","Don't let Boris Johnson make this the Brexit election – it's the climate election, and he must be defeated",Our prime minister is cynically exploiting Brexit to his personal advantage while ignoring the most urgent emergency the human species has ever faced,https://www.independent.co.uk/voices/boris-johnson-brexit-climate-change-emergency-general-election-a9177841.html,https://static.independent.co.uk/s3fs-public/thumbnails/image/2019/10/29/08/boris-johnson1.jpg,2019-10-30T14:41:00Z,"The headlines on Wednesday were all depressingly predictable: Grinches stealing Christmas, turkeys being stuffed or voting for Christmas. But there was one that I profoundly disagreed with: Its on: the Brexit election.
I disagreed for two reasons. First, thi… [+22839 chars]"
Japantimes.co.jp,No Author,England fined for encroaching on All Blacks’ haka,England has been fined for crossing the halfway line during New Zealand’s haka after players formed a provocative V-shaped formation before last weekend’s Rugby World...,https://www.japantimes.co.jp/sports/2019/10/30/rugby/england-fined-encroaching-blacks-haka/,https://cdn.japantimes.2xx.jp/wp-content/uploads/2019/10/sp-england-a-20191031-870x569.jpg,2019-10-30T04:03:34Z,"England has been fined for crossing the halfway line during New Zealand’s haka after players formed a provocative V-shaped formation before last weekend’s Rugby World Cup semifinal in Yokohama, tournament organizers said Wednesday.
Protocol states opponents … [+3267 chars]"
Independent,"Rob Knight, Rob Knight","Seven in 10 adults think their partner ignores them on purpose, poll claims","Men are the worst offenders, participants say",https://www.independent.co.uk/life-style/health-and-families/health-news/selective-hearing-partner-scrivens-hearing-care-poll-a9177886.html,https://static.independent.co.uk/s3fs-public/thumbnails/image/2019/10/30/14/istock-500842528.jpg,2019-10-30T15:30:00Z,"Seven in 10 people believe their partner has selective hearing, according to a poll.
Respondents said men were more likely than women to conveniently not hear what their partner had said.
Men will not hear what their partner is saying on seven occasions a w… [+19829 chars]"
Independent,,Who can blame women MPs for wanting to get out of politics?,Send your letters to letters@independent.co.uk,https://www.independent.co.uk/voices/letters/general-election-nicky-morgan-women-mps-quit-politics-brexit-a9180001.html,https://static.independent.co.uk/s3fs-public/thumbnails/image/2019/10/12/10/nicky-morgan.jpg,2019-10-31T18:25:00Z,"Now its Nicky Morgan. And who would blame her, or the other women who have decided to quit politics recently, when it seems they are daily bombarded with hate mail? Regardless of whether or not I agree with their politics, I think it is very sad and alarming … [+21305 chars]"
Independent,,"Let's be grateful to parliament for managing to stop an undemocratic, extreme Brexit",Send your letters to letters@independent.co.uk,https://www.independent.co.uk/voices/letters/parliament-brexit-extreme-undemocratic-election-tactical-voting-a9178101.html,https://static.independent.co.uk/s3fs-public/thumbnails/image/2019/10/29/20/election-vote.jpg,2019-10-30T16:30:00Z,I would like to take this opportunity to thank the many MPs in the current parliament who showed exactly the fighting spirit needed to prevent successive Tory administrations from forcing their various Brexits on the country without proper democratic scrutiny… [+23535 chars]
Independent,"Flora Thompson, Flora Thompson","Less than half of immigration centre detainees deported last year, watchdog finds","'Procedures for recognising and responding to vulnerability were not working consistently, and we will be continuing to monitor this over the coming year,' Dame Anne Owers says",https://www.independent.co.uk/news/uk/home-news/immigration-centre-detainees-yarls-wood-home-office-windrush-a9176971.html,https://static.independent.co.uk/s3fs-public/thumbnails/image/2019/10/07/17/home-office.jpg,2019-10-30T07:21:18Z,"Less than half of the people held in immigration detention centres last year were deported afterwards, a new report from a watchdog has found.
Of the 25,487 people who left detention in 2018, only 44 per cent were returned from the UK to another country, the… [+23373 chars]"
Independent,"David Beer, David Beer",Twitter is banning paid political ads – but what counts as 'political'?,"Political parties are so social media-savvy that banning their paid-for content might not make much of an impact. Still, Twitter's move is to be applauded",https://www.independent.co.uk/voices/twitter-ban-political-ads-general-election-uk-brexit-a9179241.html,https://static.independent.co.uk/s3fs-public/thumbnails/image/2019/10/30/20/twitter.jpg,2019-10-31T13:14:00Z,"What will Twitters ban on political advertising mean for the coming election?
The December general election will be the UKs fourth of the social media age, its fifth national poll if we count the 2016 EU referendum and each election has brought increasing co… [+22525 chars]"
Independent,"Eleanor Busby, Eleanor Busby","Black students more likely to engage in studies - but still attain lower degrees, study finds","The BME attainment gap at universities should be investigated further, report says",https://www.independent.co.uk/news/education/education-news/black-students-degrees-universities-advance-he-study-a9179226.html,https://static.independent.co.uk/s3fs-public/thumbnails/image/2018/10/18/14/student-graduation.jpg,2019-10-31T18:07:43Z,"Black students are more likely to engage and participate in their university studies - and yet a larger proportion of them obtain lower-level degrees and have lower satisfaction, according to a new a new study. 
Nearly two in three black students from the UK… [+22372 chars]"
Independent,"Peter Stubley, Peter Stubley","£250,000 violin left on train 'was stolen from luggage rack'",Police investigating disappearance of 18th century instrument hunting for man seen on CCTV,https://www.independent.co.uk/news/uk/crime/lost-violin-stolen-train-police-hunt-thief-cctv-stephen-morris-a9177751.html,https://static.independent.co.uk/s3fs-public/thumbnails/image/2019/10/30/13/violin-manhunt-police-0.jpg,2019-10-30T14:21:47Z,"A rare 18th century violin was stolen after it was accidentally left on a train luggage rack, police have said.
Musician Stephen Morris, 51, forgot to pick up the £250,000 instrument when he got off at Penge East station in south London last week.
Detective… [+20162 chars]"
Independent,"James Moore, James Moore",This will be the nastiest election in decades – and all the Electoral Commission can do is wag its finger,The maximum fine a political party can be hit with is so small it can basically be considered just another a running cost in a dirty campaign.,https://www.independent.co.uk/voices/general-election-spending-brexit-vote-leave-boris-johnson-dominic-cummings-a9179416.html,https://static.independent.co.uk/s3fs-public/thumbnails/image/2019/10/26/19/polling-station.jpg,2019-10-31T14:39:21Z,"Rather lost in yesterdays election excitement was a missive from Bob Posner, the boss of the Electoral Commission, aimed at all the parties involved along with their deep-pocketed supporters.
Posner has one of Britains most unenviable jobs: refereeing what l… [+23044 chars]"
Independent,"Zamira Rahim, Zamira Rahim",Jeremy Kyle Show: MPs condemn ITV for 'failure of responsibility' over treatment of guests,"Talk show subjected participants to 'humiliation, denigration and provocation' for purpose of entertainment, committee says",https://www.independent.co.uk/news/media/tv-radio/jeremy-kyle-itv-axed-dcms-committee-damian-collins-whistleblower-a9179631.html,https://static.independent.co.uk/s3fs-public/thumbnails/image/2019/06/25/13/the-jeremy-kyle-show-16.jpg,2019-10-31T16:43:00Z,"MPs have condemned ITV for a corporate failure of responsibility over producers treatment of guests on The Jeremy Kyle Show.
Participants on the tabloid talk show were exploited for the purpose of entertainment, said members of the Digital, Culture, Media an… [+22027 chars]"
Independent,"Moya Lothian-McLean, Moya Lothian-McLean",Carly Simon says it feels 'unnatural that men can't say something flattering to a woman without a possible reckoning',"Simon also said Harvey Weinstein ""financially raped"" her",https://www.independent.co.uk/life-style/harvey-weinstein-metoo-carly-simon-inequality-harassment-a9178946.html,https://static.independent.co.uk/s3fs-public/thumbnails/image/2019/10/31/10/gettyimages-670438740.jpg,2019-10-31T11:18:35Z,"Carly Simon has said she thinks the #MeToo movement has made it dangerous for men to act like men. 
The 74 year-old singer made the comments in an interview with The Guardian, promoting her new memoir Touched by the Sun. 
Although Simon clarified that she w… [+20960 chars]"
Independent,"Ashley Cowburn, Ashley Cowburn",General election: Government data shows huge spike in under 25 voter registration applications,"Over 177,000 individuals applied to take part in the first December general election in almost a century on Wednesday",https://www.independent.co.uk/news/uk/politics/general-election-register-vote-under-25-brexit-electoral-commission-a9179046.html,https://static.independent.co.uk/s3fs-public/thumbnails/image/2019/04/25/15/ballot-box.jpg,2019-10-31T12:38:51Z,"A considerable spike in under 25-year-olds applying for voter registration has been recorded during the first day of the general election campaign, according to government data.
As party leaders kicked off their electoral efforts on Wednesday, over 177,000 i… [+21025 chars]"
Independent.ie,Martin Coughlan,Could an English rugby victory could get prices moving?,Will England's presence in the Rugby World Cup final make any difference to the price of beef?,https://www.independent.ie/business/farming/agri-business/could-an-english-rugby-victory-could-get-prices-moving-38639461.html,https://www.independent.ie/incoming/article38634930.ece/ALTERNATES/h342/owen.jpg,2019-10-31T06:00:00Z,"To the Irish farmer, probably not, but to those at the burger and steak production end it's a different story. Sports events are big drivers when it comes to consumption. As you read this, retail orders are being taken not only in the UK but right across Euro… [+2533 chars]"
Yahoo.com,Simon Montlake,"As UK sets poll date, a voter’s dilemma: Vote on party, or vote on Brexit?","The Labour Party has long held sway in rural Wales. But Leave dominates there too. On Dec. 12, Welsh voters must choose between party and Brexit.",https://news.yahoo.com/uk-sets-poll-date-voter-153321694.html,https://s.yimg.com/cv/apiv2/social/images/yahoo_default_logo-1200x1200.png,2019-10-30T15:33:21Z,"As secretary of the rugby club, a social pillar of his village, Brian Newman has heard it all. Leave versus Remain. In versus out. Three years on, Brexit is still a topic of conversation at the clubhouse bar, an argument and a riddle that never quite ends.
O… [+8570 chars]"
Independent,"Margaret Jacobsohn, Margaret Jacobsohn","If you think The British Tribe Next Door is racist, you need to face your own prejudices",I've worked in Namibia for years as an anthropologist. I asked the Himba people myself what they thought of Channel 4's new programme – and I can tell you it's anything but 'poverty porn',https://www.independent.co.uk/voices/british-tribe-next-door-channel-4-racist-biases-a9177416.html,https://static.independent.co.uk/s3fs-public/thumbnails/image/2019/08/22/13/gogglebox-namibia.jpg,2019-10-30T11:48:13Z,"Not unexpectedly, documentary series The British Tribe Next Door has become controversial since the first episode was screened on Channel 4. Some viewers loved the first programme. Others found it thought-provoking and educational. But as always, it is the ne… [+26940 chars]"
The42.ie,Murray Kinsella,Erasmus confirms he'll step aside as Boks head coach after World Cup final,The former Munster boss will concentrate on his director of rugby role.,https://www.the42.ie/rassie-erasmus-head-coach-springboks-4873169-Oct2019/,https://img2.thejournal.ie/article/4873169/river/?height=400&version=4873172,2019-10-31T15:00:27Z,"RASSIE ERASMUS HAS confirmed that he will step aside as Springboks head coach after the World Cup.
The former Munster boss has been in the role since late 2017 but is also on a six-year contract as the South African Rugby Unions director of rugby.
Erasmus h… [+4815 chars]"
Independent,"Jon Stone, Jon Stone",New law requiring ID cards to open social media accounts debated in Italy,Proponents say rule would stop web becoming a 'sewer' but proposal faces backlash,https://www.independent.co.uk/news/world/europe/italy-id-cards-social-media-twitter-instagram-facebook-luigi-marattin-a9178976.html,https://static.independent.co.uk/s3fs-public/thumbnails/image/2019/10/31/10/twitter.jpg,2019-10-31T10:52:38Z,"Italy is debating the merits of forcing people to show an ID card before they can open a social media account, with proponents claiming the move would help tackle hate speech and fake news.
The new law proposed by a centrist MP would make it easier to trace … [+24321 chars]"
